{
  "schema_version": "1.1.0",
  "corpus_id": "example_replace_with_unique_library_id",
  "title": "Specialized research library",
  "integration": "mcp",
  "modules": [{"module_id":"research","title":"Research","description":"Specialized source-grounded knowledge."}],
  "domains": [{"domain_id":"audio","title":"Audio"}],
  "default_scope": {"read_modules":["research"],"write_modules":["research"],"source_refs":[]},
  "project_bindings": [{"project_id":"C:/Research","read_modules":["research"],"write_modules":["research"]}],
  "access": {"home_project":"C:/Research","any_project":{"read_modules":["research"],"save_modules":["research"],"author_modules":[]}}
}
